B Angie B (DVD/CD Combo)	Buying the Bayou	0.24	0.629412	0.666471	0.380952	-1.012007	0	0	-2.585285
B-17 Flying Legend	Blekingegade	0.368421	0.731849	0.758664	0.5625	-0.219928	0	0	-1.911785
B-2 Stealth Bomber	Bomb Shelter	0.421053	0.731849	0.758664	0.5625	-0.21857	0	0	-1.857872
B-2-Stealth Bomber	Battle Dome	0.421053	0.719883	0.747895	0.516129	0.261242	1	0	-1.978845
B-29 Frozen In Time	Before My Time	0.5	0.700505	0.730455	0.571429	-0.60182	0	0	-1.856328
B-29 Superfortress: Wings Of Destruction: American War Eagles	Burning Desire: The Seduction of Smoking	0.274194	0.650956	0.68586	0.446602	0.213496	1	0	-2.420849
B-52's: Time Capsule: Videos For A Future Generation (DVD/CD Combo)	Bailando por un sueño: 1er campeonato internacional de baile	0.235294	0.61793	0.656137	0.387597	0.213496	1	0	-2.609597
B-52s: Live In Germany 1983 (Hudson Music)	Berlin 1936: Games of the XI Olympiad	0.186047	0.615518	0.653966	0.345679	0.213708	1	0	-2.683606
B-52s: Live In Germany 1983 (Immortal Classics)	Berlin 1936: Games of the XI Olympiad	0.229167	0.64543	0.680887	0.372093	0.213529	1	0	-2.558356
B-52s: With The Wild Crowd!: Live In Athens, GA	Big Ideas That Changed the World	0.25	0.64831	0.683479	0.345679	0.245299	1	0	-2.572020
B-52s: With The Wild Crowd!: Live In Athens, GA (Blu-ray)	Breakfast with the Arts (Richard Rodgers: Falling in Love)	0.224138	0.639207	0.675286	0.410256	0.213496	1	0	-2.529983
B-Boy Masters: Hip-Hop Elements All-Star Weekend	Bill Bryson: Notes from a Small Island	0.244898	0.666047	0.699443	0.386364	0.213497	1	0	-2.476010
B-Boyz	Bony	0.428571	0.790476	0.811429	0.666667	-1.023216	0	0	-1.448209
B-Girl	Bad Girls	0.428571	0.819048	0.837143	0.705882	-1.217004	0	1	-1.265617
B-Girl (Blu-ray)	Bill Brand	0.470588	0.726976	0.754278	0.571429	-0.255504	0	0	-1.802566
B-Movie Blast: 50 Movie Collection	Beer, Babes & Movies	0.342857	0.663492	0.697143	0.5	1.026306	1	0	-2.254877
B-Movie: The Shooting Of 'Farmhouse Massacre' (Special Edition)	Blush: The Search for America's Greatest Makeup Artist	0.296875	0.655835	0.690252	0.403361	0.213496	1	0	-2.451972
B-Side	B-Sides	0.857143	0.958333	0.983333	0.933333	-0.821217	0	1	0.482159
B. B. King: The Blues Anthology (DVD/CD Combo)	Born to Be Wild: The Golden Age of American Rock	0.276596	0.603343	0.643009	0.4375	0.213496	1	0	-2.562277
B. East (DVD-ROM)	Book Case TV	0.277778	0.64245	0.678205	0.451613	-0.871281	0	0	-2.435555
B. Giorgi: Attitude Tu Ballet Pilates Fusion	Border Security: Australia's Front Line	0.244444	0.655556	0.69	0.423529	0.213498	1	0	-2.457080
B. Monkey (Miramax Echo Bridge)	Boxing from St. Nicholas Arena	0.21875	0.666779	0.700101	0.444444	0.884753	1	0	-2.410754
B. Monkey (Miramax)	Big Money TV	0.4	0.714103	0.742692	0.545455	0.037635	1	0	-1.968594
B.A.M.150	B.O.X.	0.5	0.738095	0.790476	0.588235	-0.760437	0	0	-1.656905
B.A.P.S	B.O.O.S.	0.625	0.805556	0.844444	0.705882	-1.106805	0	0	-1.010715
B.A.S.E. Training (Balance And Stability Exercise)	BBC Learning Episode: Brazil - Music Dance and Art	0.137255	0.650327	0.685294	0.411765	0.213496	1	0	-2.532250
B.B King: Blues Anthology: Sing Sing Thanksgiving 1972	Battle Jar: Resolving Arguments Since the Dawn of Time	0.181818	0.622906	0.660615	0.381818	0.213496	1	0	-2.625428
B.B. King / Joan Baez: Live: Sing Sing, Ossining, NY, 1972	BBQ Kings	0.152542	0.606215	0.645593	0.26087	0.213496	1	0	-2.797230
B.B. King / Turk Murphy: Jazz Casual	BBQ Kings	0.243243	0.62973	0.666757	0.382979	0.214861	1	0	-2.580380
B.B. King And Eric Clapton: Riding With The King (Audio-Only DVD)	BBC Learning Episode: Brazil - Music Dance and Art	0.242424	0.613383	0.652045	0.376068	0.213496	1	0	-2.631992
B.B. King And Joan Baez: In Concert At Sing Sing Prison, 1972	BBC Learning Episode: Brazil - Music Dance and Art	0.241935	0.609398	0.648458	0.389381	0.213496	1	0	-2.626427
B.B. King And Joan Baez: In Concert At Sing Sing Prison, 1972 (Old Version)	BBQ Kings	0.118421	0.597368	0.637632	0.209302	0.213496	1	0	-2.861726
B.B. King: Anthology (DVD/CD Combo)	BBQ Kings	0.222222	0.631481	0.668333	0.347826	0.215894	1	0	-2.626938
B.B. King: At Sing Sing Prison	Bao qing tian	0.322581	0.644393	0.679954	0.444444	0.618495	1	0	-2.409985
B.B. King: B.B. King & Friends	BBQ Kings	0.290323	0.641935	0.677742	0.439024	0.245077	1	0	-2.446664
B.B. King: B.B. King & The Guitar Legends: In Performance	Battle Jar: Resolving Arguments Since the Dawn of Time	0.206897	0.628518	0.665667	0.371681	0.213496	1	0	-2.613380
B.B. King: B.B. King Blues Master	BBQ Kings	0.264706	0.635294	0.671765	0.409091	0.219364	1	0	-2.520979
B.B. King: Blues Anthology (DVD/CD Combo)	Battlegrounds: King of the Court	0.214286	0.625008	0.662507	0.373333	0.324537	1	0	-2.617554
B.B. King: Blues Master	B.J. and the Bear	0.416667	0.690527	0.752422	0.52381	-1.052991	0	0	-2.020017
B.B. King: Blues Master Highlights	Big Love: In the Beginning	0.285714	0.661134	0.695021	0.419355	0.728591	1	0	-2.422397
B.B. King: Blues Session	Business Times on ESPN	0.28	0.678926	0.711033	0.458333	-0.966775	0	0	-2.319183
B.B. King: Blues Summit	B.A. in Music	0.458333	0.672619	0.738095	0.578947	1.401917	1	0	-1.933716
B.B. King: Jazz Legend	Boys in the Band	0.391304	0.678137	0.710323	0.45	-0.556129	0	0	-2.246607
B.B. King: Live (Geffen Records)	BYOB Bring Your Own Board	0.333333	0.654235	0.688811	0.474576	0.720934	1	0	-2.329140
B.B. King: Live (Geffen Records/ Blu-ray)	Banshee Origins: The Real Lucas Hood	0.190476	0.65506	0.689554	0.35443	0.214242	1	0	-2.569711
B.B. King: Live (Image)	Big Women, Big Love	0.25	0.680556	0.7125	0.409091	-0.603808	0	0	-2.402145
B.B. King: Live (Image/ Blu-ray)	Black in Latin America	0.272727	0.641932	0.677739	0.464286	0.585851	1	0	-2.422163
B.B. King: Live At Montreux 1993	BBQ Kings	0.242424	0.637374	0.673636	0.372093	0.221503	1	0	-2.573671
B.B. King: Live At Montreux 1993 (Blu-ray)	Babar and the Adventures of Badou	0.302326	0.622641	0.660377	0.415584	0.290515	1	0	-2.524296
B.B. King: Live At Nicks	Black in Latin America	0.36	0.687184	0.718466	0.5	-0.971913	0	0	-2.168113
B.B. King: Live At Royal Albert Hall	Big Brother Reality Allstars	0.297297	0.667227	0.700504	0.454545	0.428528	1	0	-2.347294
B.B. King: Live At Royal Albert Hall (Blu-ray)	Big Rich Texas: Whitney's Having a Baby	0.234043	0.619013	0.657111	0.390805	0.213497	1	0	-2.603429
B.B. King: Live By Request	Bear in the Big Blue House	0.296296	0.674655	0.70719	0.481481	-0.150681	0	0	-2.286039
B.B. King: Live By Request (Jewelbox)	Bear in the Big Blue House	0.342105	0.655686	0.690117	0.430769	0.779788	1	0	-2.382589
B.B. King: Live In Africa	Black in Latin America	0.461538	0.739096	0.765186	0.612245	-1.087634	0	0	-1.695378
B.B. King: Live In Africa '74	Black in Latin America	0.4	0.711745	0.740571	0.566038	0.193272	1	0	-1.940101
B.B. King: Live: Soundstage	BBC Learning: True Stories	0.321429	0.685009	0.716508	0.509091	0.366805	1	0	-2.192634
B.B. King: Live: Soundstage (Jewel Case)	British Legends of Stage and Screen	0.292683	0.670072	0.703064	0.415584	0.215615	1	0	-2.397321
B.B. King: Living Legend	Big Love: In the Beginning	0.24	0.680884	0.712795	0.461538	-0.848216	0	0	-2.334134
B.B. King: Living Legend (EAN Version)	Big Love: In the Beginning	0.307692	0.649033	0.68413	0.424242	0.761233	1	0	-2.435656
B.B. King: Master Of Blues	BBQ Kings	0.333333	0.698765	0.728889	0.486486	0.316335	1	0	-2.176356
B.B. King: Memphis Blues Session	Bear in the Big Blue House	0.424242	0.657267	0.69154	0.5	0.692385	1	0	-2.200419
B.B. King: Most Famous Hits: Live	BBQ Kings	0.264706	0.678431	0.710588	0.409091	0.219392	1	0	-2.399629
B.B. King: Night Of Blistering Blues	Bear in the Big Blue House	0.351351	0.64376	0.679384	0.53125	0.794607	1	0	-2.256610
B.B. King: Standing Room Only (Ariola)	Breaking Hollywood: One Actor at a Time	0.153846	0.637607	0.673846	0.405063	0.213508	1	0	-2.568876
B.B. King: Standing Room Only (S'More Entertainment)	Bring Me the Head of Light Entertainment	0.433962	0.632582	0.669324	0.553191	0.213496	1	0	-2.176665
B.B. King: Sweet 16: Live In Africa	Blue Angels: A Year in the Life	0.25	0.644992	0.680492	0.382353	0.357384	1	0	-2.536647
B.B. King: The Blues Anthology (DVD/CD Combo/ Slipcase)	Boy in the Bush	0.232143	0.627976	0.665179	0.361111	0.213525	1	0	-2.616456
B.B. King: The Jazz Channel Presents B.B. King: BET On Jazz	BBQ Kings	0.15	0.605556	0.645	0.257143	0.213496	1	0	-2.802395
B.B. King: The Life Of Riley	Bad Kitty: The Series	0.448276	0.682565	0.714308	0.54902	-0.445503	0	0	-2.013863
B.B. King: The Life Of Riley (Blu-ray)	Big Red: The Original Outlaw Racer	0.307692	0.665104	0.698593	0.459459	0.218164	1	0	-2.338965
B.B.G.: Black Bad Girls #21	Booty Back Packers	0.392857	0.626965	0.664269	0.468085	-0.0586	0	0	-2.369134
B.F.'s Daughter (Archive Collection/ On Demand DVD-R)	Blue Highways: Voices of the Other America	0.222222	0.638301	0.674471	0.329897	0.213496	1	0	-2.629220
B.F.G.: Big Friendly Giant	Big Break: Florida	0.222222	0.670565	0.703509	0.434783	-0.561421	0	0	-2.411382
B.F.G.: Big Friendly Giant / Toothbrush Family (2-Pack)	Britain from the Air: Flying Through History	0.196429	0.637843	0.674058	0.376238	0.213496	1	0	-2.587698
B.I.K.E.	B.O.G.E.	0.777778	0.851852	0.881481	0.777778	-0.984649	0	0	-0.436180
B.I.T.S. And Pieces: Step Ball Interval Training	Beyond Wall Street: The Art of Investing	0.265306	0.670558	0.703502	0.4	0.213496	1	0	-2.434069
B.J. Cole: Trouble In Paradise (DualDisc)	Bob the Builder: Project Build It	0.309524	0.653559	0.688203	0.394737	0.260387	1	0	-2.461628
B.J. Thomas: Christmas	Buy This Restaurant	0.304348	0.674303	0.706873	0.465116	-0.49895	0	0	-2.305846
B.J. Thomas: Hook On A Feeling: The Best Of B.J. Thomas (DualDisc)	Behind the Mask Show: The Story of the US Mercs Paintball Team	0.208955	0.613717	0.652345	0.353846	0.213496	1	0	-2.671070
B.J. Thomas: That Christmas Feeling (DVD/CD Combo)	Batalla de las Americas (Canada Competition)	0.235294	0.59976	0.639784	0.395833	0.213496	1	0	-2.646307
B.L. Stryker: The Best Of B.L. Stryker	B.L. Stryker	0.333333	0.74359	1	0.5	0.245174	1	1	-1.638342
B.L. Stryker: The Complete 1st & 2nd Seasons: The Complete Series	B.L. Stryker	0.19697	0.701632	1	0.329114	0.213496	1	1	-2.071677
B.L. Stryker: The Complete 1st Season	B.L. Stryker	0.342105	0.746289	1	0.509804	0.258545	1	1	-1.607766
B.L. Stryker: The Complete 2nd Season	B.L. Stryker	0.342105	0.746289	1	0.509804	0.258545	1	1	-1.607766
B.O.B.'s Big Break	Berlin Break	0.473684	0.68496	0.716464	0.5625	-0.539056	0	0	-1.954131
B.O.B.'s Big Break (Checkpoint)	Best Ranger Competition	0.1875	0.658292	0.692463	0.392857	0.501024	1	0	-2.516249
B.O.B.'s Big Break / Shrek 3-D: Party In The Swamp	B.O.X.	0.117647	0.604108	0.762465	0.206897	0.213496	1	0	-2.718164
B.O.B.'s Big Break / Shrek 3-D: Party In The Swamp (Checkpoint)	Behind the Mask Show: The Story of the US Mercs Paintball Team	0.203125	0.6134	0.65206	0.409449	0.213496	1	0	-2.608530
B.O.O.S.T. Karate For Children	B.O.O.S.	0.290323	0.715651	0.94313	0.45	0.224819	1	1	-1.907969
B.O.O.S.T. Karate For Children: By Robert Ferguson And Bill Wallace	B.O.O.S.	0.132353	0.668845	0.933769	0.233766	0.213496	1	1	-2.362653
B.O.Y.D.	B.O.G.E.	0.777778	0.851852	0.911111	0.777778	-0.980433	0	0	-0.383930
B.S. DVD Scrap	BS Detector	0.4	0.683333	0.715	0.518519	-1.014072	0	0	-2.112944
B.T.K.	B.O.X.	0.714286	0.809524	0.847619	0.714286	-0.913768	0	0	-0.838172
B.east	Beast	0.857143	0.952381	0.957143	0.923077	-0.738347	0	1	0.398903
B24: Bombers Over Normandy: The Victory Bombers	Buck Commander: Protected by Under Armour	0.270833	0.640873	0.676786	0.4	0.213496	1	0	-2.514057
B24: Target Japan: The Victory Bombers	Battleground Earth: Ludacris vs. Tommy Lee	0.179487	0.672302	0.705072	0.341463	0.213496	1	0	-2.542039
B24: Target Nazi Europe The Victory Bombers	Byzantium a Tale of Three Cities	0.295455	0.668586	0.701727	0.441558	0.452429	1	0	-2.363335
B24: Trilogy: Bombers Over Normandy: The Victory Bombers / Target Japan: The Victory Bombers / Target Nazi Europe ...	Brothers Grimm Fairy Tales: Poseidon God of Water - 20, Story Time	0.262712	0.559999	0.603999	0.378378	0.213496	1	0	-2.752137
B2K: Introducing B2K (DVD-Single)	BFD (Brain Food Daily)	0.323529	0.631117	0.668005	0.421053	0.913493	1	0	-2.479492
B2K: Introducing B2K (DVD-Single/ Jewelbox)	Big Ken Presents: Underground Videos	0.181818	0.614619	0.653157	0.37037	0.215064	1	0	-2.659753
B2K: Live At The House Of Blues	Bear in the Big Blue House	0.34375	0.692295	0.723065	0.508475	0.732091	1	0	-2.152635
B2K: Pandemonium! (DVD/CD Combo/ Special Edition)	Bizarre Foods - Delicious Destinations	0.26	0.619915	0.657923	0.382022	0.213496	1	0	-2.599072
B2K: Ultimate Video Collection	Ben 10: Ultimate Challenge	0.419355	0.711967	0.740771	0.62069	0.808365	1	0	-1.819134
B4 They Were ... Headliners, Vol. 1	Beyond Wall Street: The Art of Investing	0.055556	0.63802	0.674218	0.363636	0.213543	1	0	-2.634206
B4 They Were?, Vol. 2: The Four Horsemen	Best of Search for the Hottest Girl in America	0.121951	0.627051	0.664346	0.386364	0.213496	1	0	-2.626808
B4 They Were?, Vol. 3: The Clique: Shawn Michael / Scott Hall	Behind the Mask Show: The Story of the US Mercs Paintball Team	0.193548	0.651182	0.686063	0.4	0.213496	1	0	-2.524231
B4U Full Volume	Bob's Full House	0.5625	0.778186	0.800368	0.666667	-0.973408	0	0	-1.318334
B5: The Journey So Far	Better Than Four	0.304348	0.679789	0.71181	0.45	-0.559397	0	0	-2.311854
BARS [Bay Area Rap Scene] Awards: 1st Annual	Buddy Bear's Musical Adventure Happy and You Know It	0.088889	0.64142	0.677278	0.367347	0.213496	1	0	-2.617897
BASEketball	Basketball	0.75	0.856061	0.870455	0.782609	-0.915104	0	1	-0.481742
BASToF Syndrome #1: Fear & Lemons	BASToF Syndrome	0.470588	0.792892	1	0.64	0.895464	1	1	-1.120631
BASToF Syndrome #2: The Hacker	BASToF Syndrome	0.516129	0.807124	1	0.680851	0.860285	1	1	-0.944909
BASToF Syndrome #3: Riddle's Interventions	BASToF Syndrome	0.372093	0.762112	1	0.542373	0.321286	1	1	-1.487966
BASToF Syndrome #4: Secrets Revealed	BASToF Syndrome	0.432432	0.780968	1	0.603774	0.698986	1	1	-1.265384
BASToF Syndrome #5: Past Echoes	BASToF Syndrome	0.5	0.802083	1	0.666667	0.900675	1	1	-1.007452
BASToF Syndrome #6: Endgame	BASToF Syndrome	0.571429	0.824405	1	0.727273	0.26186	1	1	-0.728597
BB2005/06: Communication Agencies In Sweden (Book w/ DVD)	Buongiorno Cina - Storie del secolo cinese	0.241379	0.632338	0.669104	0.376238	0.213496	1	0	-2.582590
BBC Acting Series: Acting In Film: Michael Caine	Bassie en Adriaan en het geheim van de sleutel	0.244898	0.652971	0.687674	0.395833	0.213496	1	0	-2.500356
BBC Acting Series: Acting In High Comedy: Maria Aitken	Bassie en Adriaan en het geheim van de schatkaart	0.236364	0.657256	0.69153	0.380952	0.213496	1	0	-2.511715
BBC Acting Series: Acting In Opera: Jonathan Miller	BBC Learning Episode: Brazil - Music Dance and Art	0.269231	0.677208	0.806325	0.427184	0.213496	1	0	-2.241516
BBC Acting Series: Acting In Restoration Comedy: Simon Callow	Battle Jar: Resolving Arguments Since the Dawn of Time	0.225806	0.677835	0.710052	0.393162	0.213496	1	0	-2.443943
BBC Acting Series: Acting In Shakespearean Comedy: Janet Suzman	Bassie en Adriaan en het geheim van de schatkaart	0.265625	0.696672	0.727004	0.421053	0.213496	1	0	-2.329120
BBC Acting Series: Acting In Tragedy: Brian Cox	BBC Concert Orchestra: Learning	0.291667	0.662927	0.797756	0.475	0.267458	1	0	-2.192918
BBC Acting Series: The Complete Set: Film / Opera / Tragedy / Restoration Comedy / High Comedy / Shakespearean Comedy	Böttinger	0.076271	0.586441	0.627797	0.140625	0.213496	1	0	-2.925657
BBC Atlas Of The Natural World: Afric And Europe	Blood Feud: Blood Isn't Always Thicker Than Water	0.102041	0.644234	0.67981	0.343434	0.213496	1	0	-2.634198
BBC Atlas Of The Natural World: Collection (12-Disc)	Blood Feud: Blood Isn't Always Thicker Than Water	0.113208	0.659551	0.693596	0.330097	0.213496	1	0	-2.606848
BBC Atlas Of The Natural World: Western Hemisphere	Battle of the Sexes: in the Animal World	0.27451	0.675898	0.708308	0.413043	0.213496	1	0	-2.395587
BBC Atlas Of The Natural World: Western Hemisphere & Antarctica / Africa & Europe	Battlefield: The Battles That Won the Second World War	0.268293	0.623559	0.661203	0.379562	0.213496	1	0	-2.588094
BBC Atlas Of The Natural World: Wild Africa	Born from the Flank: Wilada Min Alkhasira	0.272727	0.645258	0.680732	0.44186	0.213496	1	0	-2.444473
BBC Big Band Orchestra: The Best Of Big Band (DVD/CD Combo)	Breakfast with the Arts (Richard Rodgers: Falling in Love)	0.166667	0.614397	0.652957	0.352941	0.213496	1	0	-2.684399
BBC Classic Comedy Collection: Black Adder, Vol. 2 & 3 / Fawlty Towers, Vol. 1 - 3 / Keeping Up Appearances, Vol. 1 / ...	Black Comedy	0.090164	0.569682	0.612714	0.177778	0.213496	1	0	-2.940719
BBC Classics Collection: Sense And Sensibility (1981) / Emma / Mansfield Park / Persuasion / Pride And Prejudice / ...	BBC 3	0.042017	0.56676	0.740056	0.08	0.213496	1	0	-2.862101
BBC Cosmic Comedy Collection: The Hitchhiker's Guide To The Galaxy (1981) / Red Dwarf Series 3 - 6	Brothers Grimm Fairy Tales: Poseidon God of Water - 20, Story Time	0.212121	0.577505	0.619755	0.337349	0.213496	1	0	-2.776336
BBC Cutting Edge Comedy Collection: The Office (2001): 1st & 2nd Series / The Office Special / Little Britain: 1st Series / ...	BBC 3	0.039062	0.565972	0.739583	0.074627	0.213496	1	0	-2.865022
BBC Drama Collection: Wives And Daughters / Middlemarch / Jane Eyre / Lost Prince / Daniel Deronda / Barchester Chronicles / ...	Boy's Life: Backstage at 'Peter and the Starcatcher' with Adam Chanler-Berat	0.255814	0.578251	0.620426	0.339806	0.213496	1	0	-2.754969
BBC Earth Collection: Planet Earth (2006) / Earth: The Biography	Battlefield: The Battles That Won the Second World War	0.215385	0.630886	0.667797	0.4	0.213496	1	0	-2.569288
BBC High Definition Natural History Collection (Blu-ray): Planet Earth (2006) / Wild China / Galapagos / Ganges	Boy's Life: Backstage at 'Peter and the Starcatcher' with Adam Chanler-Berat	0.214286	0.573493	0.616144	0.349206	0.213496	1	0	-2.772475
BBC High Definition Natural History Collection 2 (Blu-ray): Life / Nature's Most Amazing Events / Wild Pacific / ...	Bought with Love: The Secret History of British Art Collections	0.239316	0.567308	0.610577	0.364641	0.213496	1	0	-2.760689
BBC History Of World War II (12-Disc): Nazis: A Warning From History / Road To War: Great Britain, Italy, ... / ...	Bistro	0.060345	0.585796	0.627217	0.113821	0.213496	1	0	-2.937512
BBC History Of World War II (12-Disc/ Old Version): Nazis: A Warning From History / Road To War: Great Britain, Italy, ... / ...	Bistro	0.054264	0.584348	0.625914	0.102941	0.213496	1	0	-2.943917
BBC Holiday Collection (4-Disc): Are You Being Served?: Christmas Crackers / Good Neighbors: Silly But It's Fun / ...	BBC 3	0.042373	0.566855	0.740113	0.080645	0.213496	1	0	-2.861742
BBC Holiday Comedy (2-Disc): Are You Being Served?: Christmas Crackers / Good Neighbors: Silly But It's Fun / ...	Brothers Grimm Fairy Tales: Poseidon God of Water - 20, Story Time	0.22807	0.570129	0.613116	0.320442	0.213496	1	0	-2.805496
BBC Holiday Drama (2-Disc): All Creatures Great And Small: Merry Gentlemen / Ballykissangel: Happy As A Turkey On ... / ...	Boy's Life: Backstage at 'Peter and the Starcatcher' with Adam Chanler-Berat	0.217742	0.576854	0.619168	0.308458	0.213496	1	0	-2.805371
BBC Natural History Collection (Alternate UPC): Planet Earth / Blue Planet: Seas Of Life / Life Of Mammals / Life Of Birds	Boy's Life: Backstage at 'Peter and the Starcatcher' with Adam Chanler-Berat	0.243902	0.576663	0.618997	0.34	0.213496	1	0	-2.763617
BBC Natural History Collection 1: Planet Earth (Blu-ray)	Battle History of the U. S. Coast Guard	0.385965	0.63655	0.672895	0.494845	0.213498	1	0	-2.306120
BBC Natural History Collection 1: Planet Earth (Speical Edition)	Bailando por un sueño: 1er campeonato internacional de baile	0.215385	0.654449	0.689004	0.396825	0.213496	1	0	-2.509664
BBC Natural History Collection 2: Featuring Life	Boost Mobile Major League Gaming Pro Circuit	0.183673	0.674321	0.706889	0.382979	0.213496	1	0	-2.485865
BBC Natural History Collection: Planet Earth / Blue Planet: Seas Of Life / Life Of Mammals / Life Of Birds	Boy's Life: Backstage at 'Peter and the Starcatcher' with Adam Chanler-Berat	0.252336	0.577916	0.620125	0.358696	0.213496	1	0	-2.736405
BBC Royalty (2-Disc)	Bay City Blues	0.333333	0.679365	0.711429	0.388889	0.153797	1	0	-2.378410
BBC Shakespeare Plays DVD Series	Barney Blake, Police Reporter	0.242424	0.675613	0.708052	0.412698	0.641437	1	0	-2.415825
BBC Singer Of The World In Cardiff: Twenty Years	Blood & Iron: The Story of the German War Machine	0.204082	0.665454	0.698908	0.40404	0.213496	1	0	-2.475297
BBC Tudors Collection: Shadow Of The Tower / The Six Wives Of Henry VIII / The Other Boleyn Girl / Elizabeth R	Bishojo Celebrity Panchanne: The Wife is a Superheroine!	0.27027	0.570514	0.613462	0.369048	0.213496	1	0	-2.734171
BBC Ultimate Comedy Megapack: Absolutely Fabulous / Black Adder / Father Ted / Fawlty Towers / Red Dwarf / The Young Ones / ...	BC Times	0.0625	0.571181	0.614062	0.116788	0.213496	1	0	-2.965352
BBMak: Music In High Places	BPM: Music	0.357143	0.713203	0.741883	0.512821	0.491078	1	1	-2.067844
BBMak: Sooner And Later: Our First Year In America	Border Security: Canada's Front Line	0.27451	0.67973	0.711757	0.409091	0.213503	1	0	-2.389835
BBQ Pitmasters	BBQ Pitmasters	1	1	1	1	-0.720647	0	1	1.000060
BBQ Secrets: The Master Guide To Extraordinary Barbecue Cookin'	Blush: The Search for America's Greatest Makeup Artist	0.25	0.662859	0.696573	0.403361	0.213496	1	0	-2.460238
BBQ Series: BBQ Basics Ribs, Wings & Legs	Belize Sports: Rock, Paper, Scissors Championships	0.119048	0.631419	0.668277	0.387097	0.213496	1	0	-2.615544
BBQ Series: Choice Chops Veal Pork & Lamb Chops	Bret Michaels and the Zombie Apocalypse of Love	0.166667	0.660354	0.694318	0.4375	0.213496	1	0	-2.462042
BBQ Series: Grill Gourmet Meats, Marinades & Veggies	Bassie en Adriaan en de reis vol verrassingen	0.264151	0.677099	0.70939	0.40404	0.213496	1	0	-2.410596
BBQ Series: Hickory Kabob Vegetable & Meat Kabobs	Bes v rebro, ili Velikolepnaya chetvyorka	0.22	0.621429	0.659286	0.369565	0.213496	1	0	-2.628881
BBoy Footwork #1: Beginner	Bollywood on Line	0.37037	0.670465	0.703419	0.488889	-0.744742	0	0	-2.228044
BBoy Footwork #2: Intermediate	Betty Crocker Star Matinee	0.290323	0.675711	0.70814	0.413793	0.778474	1	0	-2.384957
BBoy Foundation	BET.com Countdown	0.375	0.735901	0.762311	0.588235	-0.894601	0	0	-1.845812
BBoy Freezes #1: Intermediate	Big Brother: The Insider	0.3	0.692515	0.723263	0.4	0.506385	1	0	-2.347968
BBoy Olympics	Boy Dominic	0.5	0.746032	0.771429	0.615385	-1.197997	0	0	-1.618476
BBoy Unit World Championship	Big Wolf on Campus	0.37931	0.735443	0.761899	0.541667	0.50947	1	0	-1.925689
BBoy Universe: Phenomenal Evolution (Deluxe Edition/ 2-Disc)	Bad Universe	0.180328	0.644388	0.67995	0.297297	0.213496	1	0	-2.662856
BBoys: Beyond Battles	Bobby's Dinner Battle	0.454545	0.754545	0.779091	0.636364	-0.864458	0	0	-1.603733
BCS National Championship 2008	BBC Africa Cup of Nations 2008	0.354839	0.723118	0.750806	0.580645	0.974214	1	0	-1.921534
BEET The Vandel Buster #1: The Sacrifice	Boneyard: The Secret Life of Machines	0.243902	0.690394	0.721354	0.455696	0.213584	1	0	-2.312170
BEET The Vandel Buster #2: Jiiku Warriors	Based on a Couple of True Stories	0.285714	0.656844	0.69116	0.394737	0.273562	1	0	-2.467614
BEET The Vandel Buster #3: King Of Tragedy	BET: The Next	0.232558	0.648948	0.719158	0.385965	0.227938	1	0	-2.486278
BET Four Play (4-Disc): Rhapsody / A Private Affair / Playing With Fire / Intimate Betrayal	Boy's Life: Backstage at 'Peter and the Starcatcher' with Adam Chanler-Berat	0.228261	0.597567	0.63781	0.402367	0.213496	1	0	-2.647029
BET Hip-Hop Awards 2007	Bad Trips Abroad	0.291667	0.679047	0.711143	0.439024	-0.773692	0	0	-2.338841
BET Pictures Presents: A Private Affair	Best Time Ever with Neil Patrick Harris	0.225	0.672989	0.70569	0.4	0.213499	1	0	-2.449270
BET Pictures Presents: After All	Business Matters: A Prophet Unheard	0.121212	0.684007	0.715606	0.405797	0.407167	1	0	-2.452970
BET Pictures Presents: Midnight Blue	Bravo Profiles: The Entertainment Business	0.243243	0.687217	0.718495	0.45	0.213496	1	0	-2.330109
BET Triple Play: Fire And Ice / One Special Moment / Commitments (2001)	Brothers Grimm Fairy Tales: Poseidon God of Water - 20, Story Time	0.180556	0.612003	0.650803	0.345324	0.213496	1	0	-2.694493
BET: Comic View: All Stars #01	BET's Comicview	0.387097	0.712366	0.798656	0.553191	0.852047	1	1	-1.886953
BET: Comic View: All Stars #02	BET's Comicview	0.387097	0.712366	0.798656	0.553191	0.852047	1	1	-1.886953
BET: Comic View: All Stars #03	BET's Comicview	0.387097	0.712366	0.798656	0.553191	0.852047	1	1	-1.886953
BET: Comic View: All Stars #04	BET's Comicview	0.387097	0.712366	0.798656	0.553191	0.852047	1	1	-1.886953
BET: Comic View: All Stars #05	BET's Comicview	0.387097	0.712366	0.798656	0.553191	0.852047	1	1	-1.886953
BET: Comic View: All Stars #06	BET's Comicview	0.387097	0.712366	0.798656	0.553191	0.852047	1	1	-1.886953
BET: Comic View: All Stars #07	BET's Comicview	0.387097	0.712366	0.798656	0.553191	0.852047	1	1	-1.886953
BET: Comic View: All Stars #08	BET's Comicview	0.387097	0.712366	0.798656	0.553191	0.852047	1	1	-1.886953
BET: Comic View: All Stars #09	BET's Comicview	0.387097	0.712366	0.798656	0.553191	0.852047	1	1	-1.886953
BET: Comic View: All Stars #10	BET's Comicview	0.387097	0.712366	0.798656	0.553191	0.852047	1	1	-1.886953
BFF	BFFs	0.75	0.933333	0.953333	0.888889	-0.85073	0	1	0.085866
BJ Penn 90 Days: The Journey Of The Prodigy	Back in the Day: Life on the Praries	0.431818	0.676184	0.708565	0.54321	0.215137	1	0	-2.061643
BJ Thomas: The Best Of BJ Thomas Live	Blue Highways: Voices of the Other America	0.210526	0.634749	0.671274	0.419753	0.213496	1	0	-2.536147
BJ's Teddy Bear Club And Bible Stories, Vol. 1 - 2	BJ's Teddy Bear Club & Bible Stories	0.705882	0.892952	1	0.818182	0.213502	1	1	-0.159149
